{
  "schema_id": "radi144_materialized_projection_storage_decision_v1",
  "decision": "defer_materialized_projection_storage_until_cache_policy_gate",
  "status": "materialized_projection_storage_deferred_on_demand_projection_only",
  "materialized_projection_storage_enabled": false,
  "projection_storage_tables_enabled": false,
  "projection_write_service_enabled": false,
  "worker_projection_materialization_enabled": false,
  "api_projection_reads_enabled": true,
  "source_of_truth": "module_results.result_payload_json",
  "required_future_gate": "radi144_projection_cache_policy_gate_decision",
  "blocked_storage_entities": [
    "module_projections",
    "projection_payload_json",
    "projection_cache"
  ],
  "required_invariants": [
    "no_materialized_projection_table",
    "no_projection_write_service",
    "no_worker_projection_materialization",
    "no_raw_debug_projection_storage",
    "api_read_projection_remains_on_demand",
    "stored_result_payload_remains_source_of_truth",
    "tenant_role_checks_required_before_future_storage",
    "cache_invalidation_policy_required_before_storage"
  ]
}
